Name,Date,Review,Rating,Developer,Website
Олег Митрофанов,2021-01-17,"Я объективно оцениваю застройщика. Он один из самых надежных на строительном рынке, строит быстро и качественно, никаких долгостроев нет. Раньше срока объекты не сдает, но это не столь важно, ведь у него много проектов, строящихся одновременно. Из явных минусов - цена, лично для меня все-таки дороговато, хоть спрос при этом на их жк не падает. Такого застроя не стыдно порекомендовать родным и знакомым.",4,MR Group,Forum-zhk
Светлана,2020-12-29,"Из надежных застройщиков, которые не подводили дольщиков со сроками сдачи, остановились на МР, а по цене и расположению подошел комплекс Ситибэй. Место у жк с экологической точки зрения не самое плохое, так как вредных производств в округе нет. Конечно, дорог рядом много, но мы поэтому и взяли квартиру повыше – на 26 этаже, чтобы воздух был почище, да и вид лучше. А своя набережная – это просто вишенка на торте, жить у воды – давняя мечта, которая наконец осуществится.",5,MR Group,Forum-zhk
Иван,2020-12-23,"В поисках надёжного застройщика смотрели много ресурсов в интернете, видели много отсылок на МР Групп. Они часто появляются в топах, а их проекты номинируются на разные премии. Да и вообще у застройщика много проектов, причем как комфорт, так и бизнес-класса, а значит и опыта у него достаточно. Сейчас смотрим подробнее про их проекты, прицениваемся, слава богу район не принципиален и поэтому выбор у нас достаточно большой.",5,MR Group,Forum-zhk
МАрк,2020-11-17,"Мы уже много лет живем в Москве, но только в прошлом году решились купить квартиру в ипотеку. После долгих раздумий остановились на комплексе фили сити от этого застройщика. Мы очень довольны темпами строительства и отношением сотрудников оп. Жк еще строится и я, если честно, считаю, что безопасней покупать квартиры уже в сданном доме. Но супруга изучила много информации о застройщике и его проектах и убедила меня в безопасности покупки. И уже потихоньку готовимся к приемке квартиры, потому что решили принимать без специалиста.",4,MR Group,Forum-zhk
Саша,2020-11-16,"У нас квартира в ЦП. Мы уже живем там, поэтому можем дать более развернутый комментарий насчет качества стройки. В целом все достойно, больших косяков не было, только по мелочам: окна, ручки, вытяжка- все в этом духе. Благо эти моменты застройщик исправил и нам не пришлось с ними скандалить. А так мы довольны, район здесь хороший и добираться по трешке удобно.",5,MR Group,Forum-zhk
Константин,2020-10-18,"Мы сейчас в поисках инфы о застройщике, потому что присматриваемся к его объекту в Даниловском районе. В интернете репутация у мр очень даже не плохая, часто мелькает новость о строительстве бизнес центра в Москва сити. Похоже мы выбрали самого достойного девелопера Москвы, теперь понятно почему такие цены в его комплексах. На днях собираемся в офис продаж на Дубининской, хотим воочию посмотреть на работу менеджеров и презентацию жк.",4,MR Group,Forum-zhk
Араксия,2020-08-11,"Мы только знакомимся с застройщиком, потому что нас привлек его новый проект Сити Бай. Первое впечатление очень приятное, отзывы о нем в основном положительные. Главными плюсами застройщика являются сроки сдачи домов, не увидели ни одной жалобы по этому поводу. Второе, что хочется отметить, это внешний вид всех его комплексов, они явно отличаются от других ЖК современным дизайном и, что немаловажно, своим месторасположением. Кстати, ЖК Сити Бай мы выбрали из-за его расположение на берегу Москвы-реки. Но цена тоже имела для нас значение, поэтому убедившись в хорошей репутации застройщика, мы забронировали квартиру на начальном этапе строительства, сейчас цены самые доступные.",4,MR Group,Forum-zhk
Егор,2020-07-17,"Когда выбирали квартиру, посетили много объектов, которые реализует застройщик и почитали отзывы о нем. В итоге выбрали ЖК Фили Сити, т. к. район нам больше подходит и сдача комплекса уже в этом году. Периодически проезжаем мимо и видим, как продвигается процесс – стройка идет активным ходом. В принципе и застройщик постоянно выкладывает фото и видео о проделанной работе, также наш менеджер всегда на связи. Можно, наверное, за минус отнести цены на жилье, но опять же месторасположение, качество материалов и наличие собственной коммерческой инфраструктуры соответствует ценнику.",5,MR Group,Forum-zhk
Роман,2020-06-01,"Я инвестор и уже пару раз сотрудничал с мр групп. И в защиту застройщика хотел бы сказать, что никак проблем у меня с ним никогда не возникало. В том же ясном я тоже купил квартиру. Приёмка прошла гладко, все документы после подписания АПП выдали на руки. Уже с год как квартира перепродана, и у новых владельцев так же нет проблем. Так что совершенно не понимаю, о чем идёт речь. Допускаю, что у пары человек могли быть заморочки с площадью, например, но её изменения - обычное дело в новостройке. Но о проблемах с перепланировкой я не слышал точно.",5,MR Group,Forum-zhk
Andrey,2018-12-25,"Граждане, мечтающие о приобретении жилья в Москве - не верьте застройщику МР групп!!! МР групп совершенно не заботится о гражданах, которые нередко последние деньги инвестируют в совместное долевое строительство с этим застройщиком. Мы полтора года назад (а нас как минимум 70-т семей из ЖК ""Ясный"") заплатили деньги этому застройщику, а в итоге получили совсем ДРУГИЕ квартиры. Совершенно с другой планировкой. Совсем не такие, которые оплачивали. Застройщик на наши письменные претензии не отвечает, добиться аудиенции от него не возможно! Граждан с претензиями по поводу ""кулуарной"" (самовольной и односторонней) перепланировки не принимает и не выслушивает, отгородившись девочками на ""ресепшенах""! Уже два месяца как ЖК Ясный введен в эксплуатацию, но мы не можем приступить к отделке и ремонтам в купленных нами квартирах, не имеем возможности пользоваться своим законно приобретенным имуществом. Застройщик выдает нам какие то бумажки, совсем не похожие на документы, называя их поэтажными планами и экспликацией. На них нет ни подписей, ни печатей!!! К тому же на них совершенно другие квартиры!!!! Считаем это ПОЗОРОМ Московских застройщиков!!! ОБМАНОМ своих же соинвесторов!!! Не вкладывайте свои, нелёгким трудом заработанные деньги в совместные проекты с МР групп!!! Мы также, ни чего не подозревая, в надежде на имя этого застройщика, вляпались с ним!!! Не думайте, что Вас это не коснется. Судя по отзывам от других покупателей, с других жилищных комплексов, которые делал этот МР групп, он уже давно встал на путь ОБМАНА!!! Односторонняя перепланировка на этапе строительства, без предупреждения и информирования своих дольщиков, оказывается совсем не редкий случай у МР групп! Жаль, что раньше мы этого не знали. Ни когда бы не связались с МР групп!!! ПОЗОР МР групп!!!!!",1,MR Group,Forum-zhk
