Name,Date,Review,Rating
Павел,2018-02-19,"Поражает отношение к потенциальным клиентам( при попытке выяснить цену следуют настойчивые предложения приехать в офис, ни по телефону, ни на сайте достоверных цен нет, на вопрос о том, что мне, по их логике, надо съездить за 350 км, чтобы узнать цену, разводят руками и говорят, что такова политика компании... И зачем мне такое счастье?",1
Пользователь,2018-02-15,"Долго изучала в интернете информацию о разных застройщиках, выбрала Гранель. Пишут, что компания ответственная, сроки не растягивают, цены доступные. Еще не определилась с ЖК, но выбор вроде есть. Живу одна, двушки достаточно, но на перспективу буду выбирать с хорошей инфраструктурой - и детсадом, и школой, и парковка не помешает.",4
Пользователь,2018-02-09,"Главное преимущество застройщика, на мой взгляд – множество проектов разной ценовой категории. Есть, из чего выбрать, в зависимости от своего бюджета. Также на покупку квартир действуют хорошие условия по ипотеке, это один из показателей надежности компании. Судя по отзывам моих знакомых, которые уже заселились, объекты сдаются вовремя, я пока жду своей очереди.",5
Полина,2018-02-07,"Анна, а какой гибкости вы хотели? чтобы вам квартиру дешевле продали что ли? это с чего бы вдруг? они предложили вам нормальные варианты, даже 10тыс. вернуть. что сейчас не все застройщики сделали бы!",4
Анна,2018-02-04,"Поделюсь своим опытом ""по горячим следам"". Нас заинтересовала квартира в ЖК Москвичка, забронировали ее, подписав договор оказания услуг информационного характера и пр. и оплатив 10 тыс. руб. При подписании ДДУ уже в центральном офисе, выяснилось, что стоимость квартиры отличается в бОльшую сторону, объяснили это тем, что менеджер (""Старший"" менеджер департамента продаж территориального офиса ЖК Москвичка - на минуточку) попросту рассчитала нам стоимость заинтересовавшей нас квартиры на 9-м этаже по цене квартиры на 3-м этаже. При бронировании в договоре озвученная стоимость квартиры зафиксирована не была, из подтверждения остался лишь лист с расчетами менеджера. Менеджер свою ошибку признала, но Гранель в целом гибкости не проявил, предложили нам: 1) согласиться с новой ценой или 2) отказаться от приобретения квартиры с возвратом 10 тыс. руб., уплаченных за бронирование. Считаю, что такой подход не добавляет лояльности клиентов.",3
Юлия,2018-02-03,"Выбирали квартиру в новостройке в области, и при этом что бы не далеко от Москвы. В итоге остановили выбор на ЖК Москвичка от Гранель. Понравилось расположение ЖК, к тому же почитав о Гранель и распросив всех знакомых убедились, что жилье качественное, сдают в срок, и прилигающую инфраструктуру строят.",5
Пользователь,2018-02-01,"Много хорошего слышали о застройщике от знакомых – все отзывались о нем как о честной и надежной компании. В итоге эти отзывы подтвердились. Все проекты Гранель удачные, рассчитанные на покупателей с разными финансовыми возможностями. Нам помогли быстро подготовить документы для оформления ипотеки, все подробно рассказали и объяснили. Пока ждем сдачи нашего дома.",5
Пользователь,2018-02-01,"Для нас в первую очередь была важна надежность и стабильность компании, чтобы строили без просрочек и никаких банкротств, поэтому и выбрали Гранель ведь у них по всем объектам просрочки больше квартала нигде не было, да и садики с школами они практически во всех ЖК строят и отдают их на баланс государства, что очень важно.",5
Пользователь,2018-01-31,"Гранель выбрали неслучайно, наоборот, были настроены именно на них. Знакомые уже живут в жк от этого застройщика и всем остались довольны. Мы пока ещё не въехали, но уже в скором времени получим свои ключи. Компания всё что обещает, то и выполняет - это главный плюс.",5
Николай,2018-01-30,"Нравится гранель как застройщик, ответственный. Строит в срок, сдает без косяков. При оформлении никаких проблем не было, в том числе с нашим менеджером. Сейчас ждем свои ключи, думаем о ремонте и следим за стройкой.",5
Пользователь,2018-01-26,"Выбрали Гранель по советам знакомых, многие приобрели квартиру в разных ЖК и остались довольны. Меня лично порадовало качество сервиса: менеджеры всегда готовы подсказать, посоветовать оптимальный по цене и потребностям вариант, подробно отвечают на все вопросы. Видно, что не стремятся просто «впарить» услугу, а работают на совесть. Ключи тоже получили вовремя, при сдаче квартиры не обнаружили каких-то критичных недочетов.",5
Кристина,2018-01-25,"Изначально при брони квартиры в Театральном парке нам не было сказано о том, что если мы хотим регистрировать квартиру сами, то стоимость квартиры возрастает на 100 тыс.руб. Делать нечего, заплатили гранели 40 тысяч, чтобы они занимались этой волокитой сами. Сдали документы 11 декабря, предупредили, что регистрация занимает 3-5 недель, ну, ок. В числах 12-го января начали звонить в отдел сопровождения, звонили много, раз 10, трубки никто не брал. Еле дозвонились на ресепшен, ответили, что наших документов пока нет, ждем. Муж решил ехать в компанию, нам долго пытались ""втереть"", что все отлично, ждем документы. Супруг заявил, что пока к нам не выйдет человек, ответственный за регистрацию нашей квартиры, мы никуда не уйдем. Минут через 10 вышла наша менеджер, и тут-то оказалось, что наши документы вернули из росреестра по причине нехватки нотариальной доверенности от моего имени (доверенность от лица мужа была, а о том, что должна быть и от моего имени, нам никто не сказал). Собственность оформляется на двоих, логически да, нужно было самим изначально догадаться о том, что нужно две доверенности, НО мы заплатили 40 тыс.руб.чтобы как раз таки все это прошло без геморроя и быстро для нас. Менеджер, Наметова Юлия, кажется, пыталась мне возразить, что она же при приеме документов от нас спросила у меня, все ли в порядке с документами и что я ответила утвердительно. Мало ли что я ответила, это ее работа проверять наши документы и только потом отдавать их в росреестр. Да еще нам усердно пытались сказать, что все хорошо, просто документы еще не пришли. Они нам даже не позвонили по возврату документов, чтобы сообщить о недостающей доверенности. И неизвестно, как скоро позвонили бы, если бы мы не оказались настырными. Написали жалобу на имя директора, очень надеюсь, что Юлия останется без премии, а то мы по ее вине потеряли целый месяц (кстати, теперь документы отдали по новой в росреестр и ждем опять месяц), а мы снимаем жилье и платим за него немаленькие деньги, а могли уже делать ремонт и в феврале заселиться. А еще на днях опять пытались дозвониться на ресепшен, звонили ооочень много раз, всегда было ""занято"". Супруг поехал снова в офис, там теперь нам сказали, что документы будут 4-5 февраля. Супруг не отходя от ресепшена позвонил на их номер, девочки за стойкой сидят, особо ничем не заняты, телефон их на беззвучном, только моргает зеленая лампочка при звонке,у супруга в телефоне раздается ""на данный момент все операторы заняты"". Если еще и в квартире окажутся сильные косяки, устрою им в их офисе разгром.",2
Костя,2018-01-23,"А я тот знакомый, что обычно советует брать у Гранель )) Живу не так долго, но все реально устраивает. Качество - ок, цены - ок, само место тоже. Да вообще приезжайте смотрите сами )",5
guest,2018-01-22,"Гранель не просто так набирает такую популярность. У меня знакомые живут в Валентиновке. сам же я недавно приобрел квартиру в Театральном парке и могу сказать. что хоть комплексы и разные , на лицо определенный стиль. Качество, настоящий дизайнерский подход и экологически чистая территория.",5
Пользователь,2018-01-21,"Честный и надежный застройщик. Двое моих знакомых приобрели квартиры у него в разных ЖК, всем довольны. Я пока жду своей очереди, периодически посещаю стройку, работа движется полным ходом – судя по прогнозам, никаких задержек по срокам сдачи объекта быть не должно. Для меня проекты Гранель - хороший пример соотношения цены и качества, хотя в дальнейшем, скорее всего, районы будут благоустраиваться, а жилье подорожает.",5
Катя,2018-01-17,"На мой взгляд, Гранель это компания , которая несет ответственность и за свои проекты и за своих клиентов. Гарантии выполняются, обещания тоже. Лично я за те полгода, что живу в Валентиновке еще ни разу не столкнулась с какими-либо проблемами.",4
Саша,2018-01-16,В ЖК «Театральный парк» стартовали продажи в новых корпусах. И «Государев дом» растет прямо на глазах.,4
Евгений,2018-01-15,"Меня удивляют подобные пункты договора участия в ДДУ https://www.granelle.ru/upload/iblock/1be/1be94b82c10381bd61ce370f32605567.pdf 2.4. Проектная планировка Объекта является предварительной. Стороны пришли к соглашению не признавать любое расхождение проектной и фактической площадей существенными изменениями Объекта. Фактическая площадь Объекта долевого строительства на момент передачи Участнику долевого строительства может иметь отклонения от проектной, как в большую, так и в меньшую сторону, что не влечет за собой перерасчета Цены Квартиры.",1
Артем,2018-01-11,"Федор, если гранель как все, то почему вы пришли именно сюда и пишите именно про него? И вообще в чем посыл, если по-вашему ""все такие""? В чем я не очень согласен, так как вообще-то не все застройщики сдают в срок, не все достраивают чужие дома для ждущих свои квартиры людей. Качество может не на высоте, уж не знаю какие у вас там ожидания, но оно я бы сказал НОРМАЛЬНОЕ. Вот именно что норма. А где-то стены рушатся вообще, или на приемке отваливаются двери. Так что даже не знаю.",4
Елена,2018-01-10,"Соглашусь только в одном-сейчас на Российском рынке очень сложно найти действительно стоящего застройщика. но, как я считаю, Гранель как раз такой. Социальные объекты строит, на качество, как я считаю, жаловаться не приходится. А природа какая..конфетка просто! В общем, каждому свое, конечно. Но в моем комплексе есть садик, скоро будет школа и парковка и я искренне считаю, что это достойное жилье.",5
Пользователь,2018-01-10,"Нам нравится застройщик. Следили за деятельностью, всегда новострой они сдавали в срок, поэтому выбрали именно их. Только нашу очередь задержали, были проблемы с вводом в эксплуатацию, но это продлилось всего месяца два, чему мы были рады. Квартира удовлетворяет потребностям нашей маленькой семьи. Были мелкие недочеты на кухне, нормально не закрывалось окно, но эту неисправность устранили в течение пары дней.",4
Федор,2018-01-06,"Гранель - самая обычная российская строительная компания. Как все - экономит на всём на чём может. Как все - главной задачей считает построение отношений с властными структурами, а не строительный процесс. Как все - боится наездов и передела рынка, и как следствие строит через одноразовых застройщиков с минимальным уставным капиталом. Увы, это российская действительность, иные здесь не выживают. ""Хрущёвки"" от Гранеля - данность времени. ""Хрущёвки от Гранеля"" - следствие страхов и философии выживания руководства Гранеля. Разговоры о ""надёжности застройщика"" вообще смешны в России, а о Гранеле особенно. Эволюция идёт вперёд. Торопить её, также как и самообманываться, нет смысла.",3
Наташа,2017-12-28,"Гранель ответственный застройщик, и социалку строит, все в срок и за другими достраивает дома. Поэтому мы выбрав его жк долго не сомневались, зная, что ключи получим в срок. Работы идут по социалке, это радует. Все-таки сейчас очень много семейных пар, которые берут квартиры. Так что меня удивляют застройщики, которые строят только коробки.",5
Пользователь,2017-12-27,"У нас квартира в Валентиновка парк, во второй очереди. Из минусов могу назвать лишь одно, что сдачу задержали на один квартал. На этом пожалуй все, в остальном все на хорошем уровне, несмотря на то что наш дом трехэтажный в подъезде есть лифт, что не так уж часто, во время приемки никаких существенных недочетов не было, только мелочи по сантехнике, да и то их устранили на следующий же день. При ремонте так же ничего не всплыло. в целом приятно удивлена, качественно построили по доступной цене.",4
Марьяна,2017-12-18,"Застройщиком очень довольна. Живу уже год в Государев дом и не могу пожаловаться по сути не на что. С парковками проблем нет, социальная инфраструктура, которую взял на себя застройщик уже во всю отстраивается. На диалог в случае чего всегда идет.",4
Пользователь,2017-12-18,"Мне вот что нравится на данном этапе больше всего, это полная прозрачность и открытость компании по отношению к дольщикам, раз в две недели выкладывают фотоотчет по нашей москвичке. И при чем не одни и те же фотографии, а с разных ракурсов, можно досконально оценить темпы строительства даже не бывая на объекте, только по фото. Значит скрывать нечего строят нормальными темпами.",5
Александра,2017-12-14,"В центральном офисе на Тверской заставляют часами сидеть и ждать непонятно чего, один консультант на всех клиентов, который к тебе подойти не может, на объекте такого ужаса не было",3
Пользователь,2017-12-11,"Мы тоже живем в Валентиновке парке. У нас были небольшие косяки во время приемки, но застройщик их быстро исправил, акты о приемных работах со второго раза все подписали. Удивляет тот факт, что если данный случай действительно имел место быть (комментарий Дениса), то почему вы приняли так квартиру? И если это действительно так, то я уверена, что это единичный случай, лично я о подобном у нас в ЖК еще не слышала.",4
Даша,2017-12-11,"Единичный случай, всякое бывает. У нас тоже ничего критичного не было.Приняли правда не с первого раза, а со второго)) но перерыв был небольшой, устранили там чуток по дверям, окнам довольно быстро, и мы приняли квартирку.",5
Пользователь,2017-12-11,"А у меня тоже были при приемке мелкие неисправности по сантехнике, но сотрудники довольно быстро все устранили, а при ремонте уже ничего не вылазило, да и от соседей я не слышал, чтобы что- то глобальное было, а если и были неисправности устраняли довольно оперативно.",5
Егор,2017-12-10,"Что за бредовые нападки на застройщика? Я этот отзыв уже не первый раз читаю и все время под разными именами. Ну ладно имена. Отзыв в принципе неправдоподобен. Валентиновка парк-давно сданный комплекс. И не спорю, проблемы тут есть, но чтобы застройщик ТАК игнорировал обращения жителя. Я в это в жизни не поверю. Гранель не из тех компаний, которые плюют на свою репутацию.",4
Алексей,2017-12-08,"Напрашивается закономерный вопрос.Вы на приемке этого не обнаружили? Надо было указывать в акте недостатки, требовать исправления. А тут вы опомнились, не прошло и года. Если квартира уже ваша, то к УК сначала надо идти. Причем тут прокуратура я вообще не понимаю. Гранель передал вам квартиру и вас все устраивало, но после появления трещины вы, не в чем не разобравшись, идете и баламутите воду.",4
