Name,Date,Review,Rating
Пользователь,2019-12-05,"У нас квартира в жк Малина. Многим известно что первоначальный застройщик кинул нас, своих дольщиков, а Гранель взялся за долгострой и смог всё же закончить объект. Ключи мы получили в октябре 2019 года. Давно уже думали, что профукали мы квартиру и наши многочисленные пикеты никак не помогут. Конечно не всё всегда шло как по маслу, но это и понятно, проект не от Гранель, много было работ над ошибками старого застройщика. Поэтому застройщику действительно благодарны, жильё получили.",5
Пользователь,2019-11-29,"Дико переживала за квартиру в Государев доме, сроки, качество, первая квартира как никак. Но все слава богу все обошлось, ключи вовремя выдали, да и по качеству проблем не увидела, ремонт бригада быстро сделала",5
Пользователь,2019-11-29,"Квартал Европа наш сдан окончательно вчера! Все еще не верится, как во сне каком-то, честное слово. Эти суды и заморочки с Элиткомом, казалось, что всё, остались без своих квартир. Быстрее дело пошло, когда нас стал строить Гранель, просто чудо какое-то. И Джефу Монсону дай бог здоровья, помог ускорить процесс!",5
Roman D,2019-11-29,"В конце октября получили ключи от двушки в 44 корпусе жк Государев дом. Если честно - начинали уже нервничать, так как корпуса другие без отделки получили все раньше нас, а наш с отделкой и дольше по времени. Не намного, но все таки. Оказалось, что косячок исправляли. Исправили и выдали ключи - это был самый радостный день. И мы взяли с отделкой - не пожалели, зато у нас теперь подъезды более аккуратные, чем в корпусах без отделки.",5
Пользователь,2019-11-28,"Брала в Театральном парке однокомнатную, 6 корпус. ЖК довольна – чисто, тихо и соседи приятные. С покупкой и документами не было трудностей, за что отдельное спасибо менеджерам, объясняют доступно и связь постоянно поддерживают, когда вопросы возникают",5
Арина,2019-11-27,"Сейчас у них на странице VK такое объявление: ""Если вы стоите — сядьте, если сидите — лягте. Такого раньше не было и вот опять! Мы объявляем старт акции «Новогодние условия – закачаешься!». С 23 ноября и до 31 декабря 2019 года включительно вы сможете приобрести квартиру с выгодой до 15% во всех наших проектах."" А теперь правда об этом супер предложение: Я бала у них в офисе неделю назад, квартира которую я рассматривала стоила 3 800 000 руб в Инновации (это цена уже с 13% скидкой, на самом деле эта скидка условная, для заманиловки, стоимость 3 800 000 это реальная стоимость квартир 34 кв2 в Сколково), и теперь они добавили к этой обычной скидке плюс 2%, и ""типо"" получается 15%, но самое смешное, что за неделю они уже повысили цену на 5-6%, теперь эта квартира стоит уже 4 000 000 руб (с так называемой 13% скидкой), страшно представить как вырастут цены к новому году. Что получается по факту, повысили на 6%, что бы дать 2%. Я очень расстроилась, т.к. реально хотела купить квартиру в этом ЖК и готова была оплатить полностью. Но буду искать, что нибудь другое. Жаль, что правительство не контролирует стоимость жилья, надо поднимать это вопрос, да я не хочу брать ипотеку, но я коплю уже много лет и что получается ""осел и морковка"".",1
Пользователь,2019-11-26,"Не советую. Купили квартиру по дду в ЖК Малина и не можем собственность оформить, потому что застройщик поставил квартиру на кадастровый учёт с неправильной площадью. И ничего теперь не делает. Что теперь делать непонятно",1
Иван,2019-11-25,У нас квартира в ЖК Высокие Жаворонки. Гранель достроил наконец. Хотя Мособлгаз ставил палки в колеса и всячиски затягивал процесс. Мы думали что все конец. Боялись что остались без жилья а выплатят компенсацею и все. А что та компенсацея когда квартиры дорожают. Говорим спасибо застройщику Гранель за наши достроеные дома.,5
Пользователь,2019-11-25,"Тоже имею опыт работы с Гранель, купила квартиру в Тринити, надеюсь ключи получу вовремя, хотя строят они активно и застоев на стройке нет. Думаю, к качеству не будет нареканий, все-таки Гранель не один ЖК строит и раскупаются они активно, а выводы после сдачи сделаем",5
Пользователь,2019-11-24,"О компании узнали благодаря друзьям, они у Гранель квартиру купили и вьехать успели, остались довольны. У нас вот выбор пал на жк Москвичку, мы пока ещё ждём окончания строительства нашего корпуса. Застройщик понравился тем, что заботится обо всех аспектах жк, выбирает хорошее расположение и строит инфраструктуру. У нас например комплекс находится всего в 12 км от Москвы и необходимой соц инфраструктурой будем обеспечены- сады, спортивная школа и магазины.",5
Раиса,2019-11-22,Хотим поблагодарить застройщика за свою квартиру в ЖК Малина. Все таки получили ключи от своей первой квартиры. Спасибо что достроили наш комплекс. Теперь будем ждать когда администрация Нахабино построит школу и детский садик.,5
Пользователь,2019-11-22,"Получили свою квартиру в Государевом доме ещё в октябре. Бригада делает ремонт, а хочется уже въехать и жить. После уже пожалели, что не взяли квартиру в 44 корпусе: там хоть и чуть позже выдали ключи, чем корпусам без отделки, но зато и люди сразу въехали.",5
Дмитрий,2019-11-21,"Наш 13 корпус уже почти готов, спасибо застройщику. Столько лет просрочки было, а потом нас стал достраивать Гранель - и тогда появилась явная надежда получить свои ключи. Достойный застройщик, каких мало.",5
Августина,2019-11-19,"Добрый день, знакомые искали квартиру и естественно рассматривали все вариаты , звонили в Москвичку, но -дорого.(к слову,там уже давно нет акции) Решили взять в ЖК ""ГД"" и тут я решила поучавствовать в акции ""Приведи друга"", привела, оформили,НО ... Гранель не выполняет свои обязательства, отказ, мотивируя, что покупатель звонил летом в Москвичку, НО в Москвичке нет акции, и взяли то мы в ГД.ЖДУ МОТИВИРОВАННЫЙ ОТКАЗ в письменном виде и думаю, что придется с ними судиться за обман.",1
Татьяна,2019-10-27,"Застройщик с надёжной репутацией, внушает доверие. Объекты строит активно, застоев по объектам нет. Для нас при покупке жилья в новостройке это было хорошим показателем. Приобрели квартиру в Москвичке как только старт продаж был открыт, в конце этого года наш 2 корпус уже обещают сдать, там совсем немного работ осталось.",5
Миша,2019-10-24,"Квартира в 50 корпусе Государева дома. Ключи получили буквально на днях, 19 октября, сразу же запустили туда ремонтников, потому что давно уже были на низком старте. Стройматериалы загодя закупили, дизайн-проект квартиры заказали, осталось теперь дождаться окончания ремонта. Это очень круто владеть своей первой квартирой.",5
Николай,2019-10-23,"Мы получили ключи в 44 корпусе, раньше срока по ДДУ. Покупали квартиру с отделкой от застройщика, чтобы не возиться с ремонтом, а сразу въехал и живи. Единственное, из-за чего волновались, — нашему корпусу немного позже выдали ключи, чем корпусам, которые шли без отделки. Но в итоге и мы с ключами и счастливы.",5
Сергей,2019-10-22,"Мы тоже с семьей живём в Государевом Доме, корпус 12, и на данном этапе строительства довольны компанией. Ключи получили в феврале 2017, инфраструктуры тут еще почти не было. Сейчас вот уже функционирует на территории комплекса новая школа, два муниципальных детских садика, ТЦ, пункт полиции и много разных магазинчиков. Понятно, что работы еще много впереди, но и проделано уже немало. Для нас главное что постепенно отстраивается вся инфраструктура, без нее бы здесь было тяжело.",5
Игорь,2019-10-21,"Приобрел квартиру в ЖК Государев дом. При покупке активно говорилось про ""свободную планировку"", возможность, в том числе, расширить кухню, что нами и было сделано. Итог - данную перепланировку узаконить невозможно не только через администрацию, но даже по суду, так как часть кухни находится под жилым помещением соседей сверху. Кроме того, представители Гранель сообщили кучу, по другому не скажешь, информации, которая в дальнейшем оказалась несоответствующей действительности: Ваш дом крайний, хотя уже через год построили ещё два, достраивают третий; через год будет автостоянка, торговый, медицинский центр, физкультурно-оздоровительный комплекс. В итоге - время идёт, ничего подобного мы не видим, парковаться абсолютно негде, зато жилые дома появляются в десяти метрах друг от друга со стремительной скоростью. Крайне недоволен компанией и отношением к клиентам.",1
Ирина,2019-10-07,"Нашему 45 корпусу выдали ключи в сентябре, мы рады невозможно. Наконец-то своя квартира, надоело по съемным ездить, делаем ремонт, да и въезжаем.",5
Елена,2019-10-03,"Купила квартиру в ЖК ""Государев дом"". Сдача дома (корпус 43) по договору в ноябре 2019, ключи начали выдавать уже в сентябре. В связи с небольшими недочетами, ключи еще не получены, обещали позвонить. На данный момент прошло 5 дней, жду звонка. Неудобство в том, что нет обратной связи с площадкой, неясно какие претензии будут учтены и сроки их выполнения. Сказали, если не дождетесь звонка, нужно ехать на место.",4
Пользователь,2019-09-16,"Гранель, кстати, нормальный застройщик! Во всяком случае, с готовностью идут на контакт со своими клиентами. Без проблем исправляют недоделки ""джамшутов"", если такое имеют место быть при приемке. У нас проблем с этим не было вообще.",5
Пользователь,2019-09-15,"Купили квартиру в Москвичке. Дом пока ещё не построен, ждём ключей в конце года. Сначала понаблюдали за строительством первых корпусов, сданы были вовремя, проблем каких-то особых не было. Как убедились всё строится нормально, так квартиру и приобрели. С оформлением тоже никаких проволочек не было, сделали всё быстро.",5
Пользователь,2019-09-14,"Хочу взять квартиру в Театральном парке. Сам комплекс нравится по многим параметрам, и идея с малоэтажностью удачная и экологическая обстановка благоприятная. О застройщике почитала много хороших отзывов в интернете, оказалось ещё и знакомые купили квартиру в другом жк, но тоже у Гранель. Они остались довольны, так что смысла им недоверять не вижу, буду брать.",5
Пользователь,2019-09-12,"Полтора года назад, вопреки всем трудностям, купила студию в Москвичке! И вот ни разу не пожалела! Страхи были, конечно! Риски вложится в долгострой всегда есть, но меня чутье не подвело! Во всяком случае и жилье свое есть, и проблем с транспортом нет, потому что до метро рукой подать. При приемке, кстати, никаких значительных замечаний не было.",5
Илья,2019-09-10,"Как владелец одного из детища Гранеля - кв в Валентиновка-парк скажу - отвратительное качество и удивительная криворукость работяг. Трубы стояка горячей воды чуть ли не винтом закручены - сэкономили на нормальных и повело, пришлось переделывать, лоджии типа сдавались с отделкой - это представляет собой следующее - к пеноблокам пришлепано 2 листа стекловаты на них приклеяна сетка и все это заштукатурено криво, т.е. покупателям тупо надо сдирать эту опасную стекловату - иначе даже не к чему прицепиться. Под стекловатой обнаружились НЕ СВЯЗАННЫЕ между собой стены из пеноблоков с щелями в 3 см!! Заваленные тоже на 3 см по вертикали! Подъезд на входе и цоколь отделан плиткой - скользкой и дешевой которая отваливается пластами и трескается, но под плиткой еще ужасней - бетон ступенек просто крошится как песок. Это ж надо было такое в принципе придумать как вариант ...",1
Пользователь,2019-09-08,"Гранель на 2% поднимает цены во всех своих комплексах. А я все думала, что-то не слышно про новые громкие акции от Гранель. Теперь причина понятна)",5
Пользователь,2019-09-07,"Объекты у застройщика хорошие, мы купили квартиру в ГД, всё понравилось. Дома построены хорошо, ключи получили без задержки. Акты приёмки со второго раза подписали. К качеству серьёзных нареканий не было, просто были небольшие недочёты и их быстро исправили .",5
Пользователь,2019-09-01,"Мы с женой купили квартиру у этого застройщика в Театральном парке. Наш дом обещали сдать изначально во втором квартале 2021 года. Совсем недавно узнали отличную новость для нас - сроки ввода в эксплуатацию изменили и ключи обещают выдасть раньше, в августе 2020. Это очень приличный сдвиг во времени и мы очень рады.",5
Николай,2019-08-31,"Гранель застройщик отвественный. Когда с нашей стороны возникла небольшая заминка с документами при оформлении покупки, менеджер застройщика помогала всячески и делом, и советом. В итоге все в порядке, оформили покупку квартиры в ЖК Пехра, ждем окончания строительства и ключей.",5
Владимир,2019-08-27,"Приобрели квартиру в ЖК Малина, дом давно сдан, но с 5 июля дома не могут поставить на кадастровый учёт. На квартиру нашли покупателя с ипотекой, срок одобрения заканчивается. В итоге сегодня 27 августа 2019 получили ответ, что недочёты в документации до сих пор не исправлены, сделка будет сорвана. Ответственности никакой, застройщика не рекомендуем. По поводу задержки сроков сдачи вообще будем подавать в суд, 200 000 руб. ущерба компенсировать отказались.",2
Пользователь,2019-08-21,"Купили квартиру в строящемся доме в жк Новая Рига. Ценники на жильё застройщик выставил адекватные, незавышенные. Стройка на месте не стоит. Отчёты своевременно выкладываются, фотки тоже часто обновляют на главном сайте. Условия для проживания обещают хорошие, в жк обещают благоустройство по полной и строительство необходимой инфраструктуры. Репутация застройщика положительная, объекты свои сдают без задержек, ещё и за чужие долгострои берутся.",5
Пользователь,2019-08-06,"Ответственный застрой, сроки практически никогда не нарушает в отличие от многих других строительных компаний. Если и бывают задержки, то минимальные, а еще я читала и раньше срока умудряется свои дома в эксплуатацию вводить. Мы получили свою квартиру в Государевом Доме точно в срок, не раньше, ни позже. Качество нормальное, недостатков не было при приемке, акты все сразу подписали. Инфраструктура на месте не стоит, строится, много чего уже даже построили из обещанного.",5
Пользователь,2019-08-04,"Хороший застройщик, взял на себя чужой долгострой, а именно ЖК ""Малина"", дольщики ключи уже начали получать. Я являясь жильцом данного комплекса, свою квартиру тоже уже получила и скоро смогу жить в ней, как только с ремонтом разберусь. Если честно, то до этого я таких грандиозных планов уже и не строила, после Фрегата никому верить не хочется. Спасибо Гранель за то, что отстраивают не только свои объекты, но и берутся за чужие, иначе неизвестно чем бы у нас дело закончилось.",5
